{
  "$schema": "https://json-schema.org/draft/2020-12/schema",
  "$id": "https://diskprune.com/schemas/storage-rules.json",
  "title": "DiskPrune storage rules",
  "type": "object",
  "additionalProperties": false,
  "required": ["schemaVersion", "rulesVersion", "rules"],
  "properties": {
    "schemaVersion": { "type": "integer", "const": 1 },
    "rulesVersion": { "type": "string", "minLength": 1 },
    "generated": { "type": "boolean" },
    "source": { "type": "string" },
    "rules": {
      "type": "array",
      "minItems": 1,
      "items": { "$ref": "#/$defs/rule" }
    }
  },
  "$defs": {
    "rule": {
      "type": "object",
      "additionalProperties": false,
      "required": [
        "id",
        "paths",
        "displayName",
        "category",
        "safety",
        "regenerable",
        "producer",
        "explanation",
        "consequence",
        "minMacOS",
        "docsURL",
        "lastReviewed",
        "publish"
      ],
      "properties": {
        "id": { "type": "string", "pattern": "^[a-z0-9]+(-[a-z0-9]+)*$" },
        "paths": {
          "type": "array",
          "minItems": 1,
          "items": {
            "type": "string",
            "pattern": "^(/|~/).+"
          }
        },
        "envOverride": { "type": "string", "minLength": 1 },
        "displayName": { "type": "string", "minLength": 1 },
        "category": {
          "type": "string",
          "enum": [
            "developerBuild",
            "packageCache",
            "applicationCache",
            "log",
            "applicationSupport",
            "containerData",
            "virtualDisk",
            "snapshot",
            "application",
            "userData",
            "unknown"
          ]
        },
        "safety": {
          "type": "string",
          "enum": ["safe", "review", "advanced", "protected"]
        },
        "regenerable": { "type": "boolean" },
        "producer": { "type": "string", "minLength": 1 },
        "explanation": { "type": "string", "minLength": 40 },
        "consequence": { "type": "string", "minLength": 40 },
        "howItComesBack": { "type": "string", "minLength": 1 },
        "minMacOS": { "type": "string", "pattern": "^[0-9]+\\.[0-9]+$" },
        "docsURL": {
          "anyOf": [
            { "type": "string", "pattern": "^https://" },
            { "type": "null" }
          ]
        },
        "lastReviewed": { "type": "string", "pattern": "^[0-9]{4}-[0-9]{2}-[0-9]{2}$" },
        "publish": { "type": "boolean" }
      }
    }
  }
}
