{
  "schemaVersion": 1,
  "rulesVersion": "2026.09.1",
  "rules": [
    {
      "id": "xcode-deriveddata",
      "paths": [
        "~/Library/Developer/Xcode/DerivedData"
      ],
      "envOverride": "DERIVED_DATA_PATH",
      "displayName": "Xcode DerivedData",
      "category": "developerBuild",
      "safety": "safe",
      "regenerable": true,
      "producer": "Xcode",
      "explanation": "Intermediate build products Xcode writes while compiling each project. They are large, machine-local, and not part of your source tree.",
      "consequence": "The next build of each affected project will be a full rebuild and take longer. Source code, git history, and archives are not touched.",
      "howItComesBack": "Open the project in Xcode and build. DerivedData is recreated automatically.",
      "minMacOS": "14.0",
      "docsURL": "https://developer.apple.com/documentation/xcode",
      "lastReviewed": "2026-09-08",
      "publish": true
    },
    {
      "id": "xcode-modulecache",
      "paths": [
        "~/Library/Developer/Xcode/DerivedData/ModuleCache.noindex"
      ],
      "displayName": "Xcode Module Cache",
      "category": "developerBuild",
      "safety": "safe",
      "regenerable": true,
      "producer": "Xcode",
      "explanation": "Clang's shared module cache used to speed up compilation of imported modules across projects. It is regenerated on the next compile.",
      "consequence": "The first few builds after removal compile modules from scratch. No project settings or source files are affected.",
      "howItComesBack": "Xcode recreates ModuleCache.noindex the next time a target imports a module.",
      "minMacOS": "14.0",
      "docsURL": "https://clang.llvm.org/docs/Modules.html",
      "lastReviewed": "2026-09-08",
      "publish": false
    },
    {
      "id": "npm-cacache",
      "paths": [
        "~/.npm/_cacache"
      ],
      "envOverride": "npm_config_cache",
      "displayName": "npm package cache",
      "category": "packageCache",
      "safety": "safe",
      "regenerable": true,
      "producer": "npm",
      "explanation": "Content-addressed cache of tarballs npm has already downloaded. It exists only to avoid re-fetching packages from the registry.",
      "consequence": "The next npm install re-downloads packages that were only in this cache. package.json and node_modules in your projects are not modified.",
      "howItComesBack": "Run npm install in a project; npm repopulates _cacache from the registry.",
      "minMacOS": "14.0",
      "docsURL": "https://docs.npmjs.com/cli/v10/commands/npm-cache",
      "lastReviewed": "2026-09-08",
      "publish": true
    },
    {
      "id": "pnpm-store",
      "paths": [
        "~/Library/pnpm/store",
        "~/.pnpm-store"
      ],
      "envOverride": "PNPM_HOME",
      "displayName": "pnpm content store",
      "category": "packageCache",
      "safety": "safe",
      "regenerable": true,
      "producer": "pnpm",
      "explanation": "pnpm's global content-addressable store. Project node_modules directories hardlink or copy from here rather than duplicating every package.",
      "consequence": "Projects using pnpm will re-fetch packages on the next install. Existing project lockfiles are not changed.",
      "howItComesBack": "Run pnpm install; the store is rebuilt from the registry as needed.",
      "minMacOS": "14.0",
      "docsURL": "https://pnpm.io/npmrc#store-dir",
      "lastReviewed": "2026-09-08",
      "publish": false
    },
    {
      "id": "yarn-cache",
      "paths": [
        "~/Library/Caches/Yarn",
        "~/.yarn/berry/cache"
      ],
      "displayName": "Yarn package cache",
      "category": "packageCache",
      "safety": "safe",
      "regenerable": true,
      "producer": "Yarn",
      "explanation": "Offline cache of packages Yarn has already fetched. Classic Yarn and Yarn Berry keep this in different locations; both are regenerable.",
      "consequence": "The next yarn install downloads packages again. Your repository lockfile and source are untouched.",
      "howItComesBack": "Run yarn install. Yarn restores the cache from the registry.",
      "minMacOS": "14.0",
      "docsURL": "https://yarnpkg.com/features/offline-cache",
      "lastReviewed": "2026-09-08",
      "publish": false
    },
    {
      "id": "cargo-registry-cache",
      "paths": [
        "~/.cargo/registry/cache"
      ],
      "envOverride": "CARGO_HOME",
      "displayName": "Cargo registry cache",
      "category": "packageCache",
      "safety": "safe",
      "regenerable": true,
      "producer": "Cargo",
      "explanation": "Compressed crate files Cargo downloaded from crates.io (or another registry). The src/ checkout of those crates lives beside this cache.",
      "consequence": "The next cargo build that needs a crate will re-download it. Cargo.lock and your crate sources are not modified.",
      "howItComesBack": "Run cargo build or cargo fetch; the registry cache is filled again.",
      "minMacOS": "14.0",
      "docsURL": "https://doc.rust-lang.org/cargo/guide/cargo-home.html",
      "lastReviewed": "2026-09-08",
      "publish": true
    },
    {
      "id": "gradle-caches",
      "paths": [
        "~/.gradle/caches"
      ],
      "envOverride": "GRADLE_USER_HOME",
      "displayName": "Gradle caches",
      "category": "packageCache",
      "safety": "safe",
      "regenerable": true,
      "producer": "Gradle",
      "explanation": "Downloaded dependencies, generated jars, and transform caches Gradle uses so subsequent builds do not hit the network.",
      "consequence": "The next Gradle build re-downloads and re-transforms dependencies. Project source and gradle.properties are not touched.",
      "howItComesBack": "Run the Gradle build; caches are restored from configured repositories.",
      "minMacOS": "14.0",
      "docsURL": "https://docs.gradle.org/current/userguide/directory_layout.html",
      "lastReviewed": "2026-09-08",
      "publish": true
    },
    {
      "id": "maven-repository",
      "paths": [
        "~/.m2/repository"
      ],
      "displayName": "Maven local repository",
      "category": "packageCache",
      "safety": "safe",
      "regenerable": true,
      "producer": "Maven",
      "explanation": "Local copy of artifacts Maven has resolved. It is a cache, not your project's source or the remote repository.",
      "consequence": "The next mvn invocation re-downloads missing artifacts. pom.xml files are not modified.",
      "howItComesBack": "Run mvn package or mvn dependency:resolve; artifacts return to ~/.m2/repository.",
      "minMacOS": "14.0",
      "docsURL": "https://maven.apache.org/guides/introduction/introduction-to-repositories.html",
      "lastReviewed": "2026-09-08",
      "publish": false
    },
    {
      "id": "cocoapods-cache",
      "paths": [
        "~/Library/Caches/CocoaPods"
      ],
      "displayName": "CocoaPods cache",
      "category": "packageCache",
      "safety": "safe",
      "regenerable": true,
      "producer": "CocoaPods",
      "explanation": "Downloaded pod specs and source archives CocoaPods keeps so pod install does not re-fetch every dependency.",
      "consequence": "The next pod install re-downloads pods. Your Podfile and Podfile.lock stay in place.",
      "howItComesBack": "Run pod install; CocoaPods rebuilds this cache from the spec repos.",
      "minMacOS": "14.0",
      "docsURL": "https://guides.cocoapods.org/using/using-cocoapods.html",
      "lastReviewed": "2026-09-08",
      "publish": false
    },
    {
      "id": "spm-cache",
      "paths": [
        "~/Library/Caches/org.swift.swiftpm"
      ],
      "displayName": "Swift Package Manager cache",
      "category": "packageCache",
      "safety": "safe",
      "regenerable": true,
      "producer": "Swift Package Manager",
      "explanation": "Cloned package checkouts and build artifacts SwiftPM stores outside your project so packages are reused across Xcode projects.",
      "consequence": "The next Xcode or swift build that needs a package will re-clone it. Package.swift manifests are not changed.",
      "howItComesBack": "Resolve packages in Xcode or run swift package resolve.",
      "minMacOS": "14.0",
      "docsURL": "https://www.swift.org/documentation/package-manager/",
      "lastReviewed": "2026-09-08",
      "publish": false
    },
    {
      "id": "homebrew-cache",
      "paths": [
        "~/Library/Caches/Homebrew"
      ],
      "envOverride": "HOMEBREW_CACHE",
      "displayName": "Homebrew cache",
      "category": "packageCache",
      "safety": "safe",
      "regenerable": true,
      "producer": "Homebrew",
      "explanation": "Downloaded bottle archives and source tarballs Homebrew keeps after installs and upgrades. Installed kegs live in the Homebrew prefix, not here.",
      "consequence": "The next brew install or upgrade re-downloads bottles. Already-installed formulae keep working.",
      "howItComesBack": "brew install or brew fetch restores downloads. brew cleanup is the Homebrew-native way to prune this cache.",
      "minMacOS": "14.0",
      "docsURL": "https://docs.brew.sh/Manpage#cleanup-options-formulacask-",
      "lastReviewed": "2026-09-08",
      "publish": true
    },
    {
      "id": "user-caches",
      "paths": [
        "~/Library/Caches"
      ],
      "displayName": "User Library Caches",
      "category": "applicationCache",
      "safety": "safe",
      "regenerable": true,
      "producer": "macOS applications",
      "explanation": "Per-app caches under ~/Library/Caches. macOS and apps are expected to recreate this data. Individual subfolders are classified separately when a more specific rule matches.",
      "consequence": "Apps may launch slower once while they rebuild caches. Documents, photos, and application support files are not in this folder.",
      "howItComesBack": "Launch the app. Caches are recreated on demand.",
      "minMacOS": "14.0",